,title,company,salary,summary
0,Java Developer,Azine Web Technologies Pvt. Ltd.,"₹50,000 - ₹80,000 a month","Expert in using Java, JavaScript – Development ,Deployment, Testing and Debugging.Familiarity with object-oriented and functional programming concepts and…"
1,LTI Hiring for UI Developer,Larsen & Toubro Infotech Limited,,"Good to have knowledge of Maven, Angular, HTML, CSS and JAVA script Must have knowledge on basic Database queries."
2,Java Developer,Larsen & Toubro Infotech Limited,,"Rich Expertise in Java frameworks like Spring MVC, Springboot, Multithreading, Hibernate, RestAPI and Microservices.Exposure to CI & CD tools."
3,Jr. Java Developer,"Punctuations Solutions Pvt, Ltd.","₹2,00,000 - ₹4,00,000 a year","0-1 years of industry experience.Good understanding and knowledge of spring/spring boot, microservices.Knowledge of creating web applications using Java and…"
4,Fresher (Java Developer),Transdigital Technology services Pvt Ltd,"₹2,80,000 - ₹3,00,000 a year",You will become a full-stack developer on completion of this training.Good conceptual understanding of Software Engineering development processes.
5,Java Developer,Wissen Technology,"₹83,000 - ₹2,50,000 a month","JD : Experience in Core Java, Data Structures, OOPS, Multithreading, Algorithms, Collection framework, Unix/Linux, SQL."
6,Java Developer (Junior),FENG GROUP,,Our client in the consumer electronics industry is looking for a junior java developer.The ideal candidate will be efficient in designing and developing high…
7,Jr Java Developer- 1 Year Exp,Transdigital Technology services Pvt Ltd,"₹4,00,000 - ₹5,00,000 a year",Develop & implement new software programs under the guidance of Tech Lead/ Tech Architect.Maintain & improve the performance of existing software.
8,"Navi Mumbai - Java, Springboot Fullstack Developer",JForce Solutions,"₹2,40,000 - ₹7,00,000 a year",JForce Solutions is looking for developers who have excellent coding skills and who can start contributing right away.
9,Java Developer,Neosoft,"₹10,00,000 - ₹20,00,000 a year","We are looking for Java Developers who have proficient experience in Sprint Boot framework.Someone who is ingenious, focussed and will work collaboratively…"
10,Java/J2EE Developer,view tech soln,"₹18,000 - ₹22,500 a month","FRESHER OR 6 MONTH COMPLETED INTERSHIP OR FULL STAGE JAVA COURSE FROM CADC/ SEED/ NIIT ETC.Mumbai, Maharashtra: Reliably commute or planning to relocate before…"
11,Software Developer-Java/Spring Boot,Oracle,,"Design, develop, troubleshoot and debug software programs for databases, applications, tools, networks etc.Duties and tasks are standard with some variation;…"
12,Java developer,Oracle,,"Minimum Experience : 10 to 12 years.Java, J2EE technologies, JBOSS EAP, JMS and IBM MQ, Unix Scripting and Oracle PL/SQL.May act as the team lead on projects."
13,Java Developer,Aarav Global Products & Services Pvt LTD,"₹12,00,000 - ₹18,00,000 a year",Should co-operate with the frontend developer in the integration process.We are looking for *JAVA Developers with 5 Plus years of Experience* for our Client in…
14,Java Developer,Corner Solutions,"₹20,000 - ₹70,000 a month","Develop Java webservices and components according to a detailed design document.Build efficient, reusable and reliable Java code per industry best practices."
15,Java Developer,Azine Web Technologies Pvt. Ltd.,"₹50,000 - ₹80,000 a month","Expert in using Java, JavaScript – Development ,Deployment, Testing and Debugging.Familiarity with object-oriented and functional programming concepts and…"
16,LTI Hiring for UI Developer,Larsen & Toubro Infotech Limited,,"Good to have knowledge of Maven, Angular, HTML, CSS and JAVA script Must have knowledge on basic Database queries."
17,Fresher (Java Developer),Transdigital Technology services Pvt Ltd,"₹2,80,000 - ₹3,00,000 a year",You will become a full-stack developer on completion of this training.Good conceptual understanding of Software Engineering development processes.
18,Java Developer,ABM Knowledgeware Ltd,"₹3,00,000 a year",Relevant exposure in IT Industry as a developer.Freshers or up to 2 years’ experience with good knowledge on Java concepts.
19,Jr. Java Developer,"Punctuations Solutions Pvt, Ltd.","₹2,00,000 - ₹4,00,000 a year","0-1 years of industry experience.Good understanding and knowledge of spring/spring boot, microservices.Knowledge of creating web applications using Java and…"
20,Java Developer (Junior),FENG GROUP,,Our client in the consumer electronics industry is looking for a junior java developer.The ideal candidate will be efficient in designing and developing high…
21,Java Developer,Wissen Technology,"₹83,000 - ₹2,50,000 a month","JD : Experience in Core Java, Data Structures, OOPS, Multithreading, Algorithms, Collection framework, Unix/Linux, SQL."
22,Trainee Programmer- Java Developer,Proteus Technologies Private Limited Company,"₹2,00,000 a year","Proteus Technologies Pvt. Ltd is a Mumbai Based IT Company and one of the leading Enterprise Resource Planning (ERP), Warehouse Management system (WMS) and…"
23,Jr Java Developer- 1 Year Exp,Transdigital Technology services Pvt Ltd,"₹4,00,000 - ₹5,00,000 a year",Develop & implement new software programs under the guidance of Tech Lead/ Tech Architect.Maintain & improve the performance of existing software.
24,Java/J2EE Developer,view tech soln,"₹18,000 - ₹22,500 a month","FRESHER OR 6 MONTH COMPLETED INTERSHIP OR FULL STAGE JAVA COURSE FROM CADC/ SEED/ NIIT ETC.Mumbai, Maharashtra: Reliably commute or planning to relocate before…"
25,Java Developer,Neosoft,"₹10,00,000 - ₹20,00,000 a year","We are looking for Java Developers who have proficient experience in Sprint Boot framework.Someone who is ingenious, focussed and will work collaboratively…"
26,Software Developer-Java/Spring Boot,Oracle,,"Design, develop, troubleshoot and debug software programs for databases, applications, tools, networks etc.Duties and tasks are standard with some variation;…"
27,Java/J2EE Developer,Go Digital Technology,"₹3,00,000 - ₹7,00,000 a year","Can work as a full stack developer role.All below mentioned points under guidance of lead enginner.API Development using Spring core,Spring MVC, Springboot 2…"
28,"Navi Mumbai - Java, Springboot Fullstack Developer",JForce Solutions,"₹2,40,000 - ₹7,00,000 a year",JForce Solutions is looking for developers who have excellent coding skills and who can start contributing right away.
29,Java Developer,Bootlabs,"₹1,50,000 - ₹2,50,000 a month",Must Have worked in a product development for minimum of 1 years or Fresher with very.Must Understand the Product life cycle (Requirement analysis/ design…
